{
  "schema": "omdsh-workshop-harness-plan/v1",
  "engineVersion": "1.1.0",
  "id": "almanac-mcp@0.1.0-rc.2:0.1.0-rc.6:mcp",
  "projectId": "almanac-mcp",
  "releaseId": "almanac-mcp@0.1.0-rc.2",
  "source": {
    "repository": "https://github.com/omdsh-dev/toybox",
    "ref": "86e98729b92db0b9fe901c39e32bca74cf8c0f54",
    "path": "/plugins/almanac-mcp/.dsh-plugin"
  },
  "updateFrom": null,
  "baseline": {
    "package": "@deepseek-ai/dsh",
    "version": "0.1.0-rc.6",
    "integrity": "sha512-brpZfED7ieRa2PQ5tUxMhHrM1pb2CmKFVM/f6yMULBDMicahk+Z2OsHgTwTDnoiZm23Ftu9rQz0NN4pflaoJcg=="
  },
  "profileBase": null,
  "loaderAdapter": null,
  "classification": {
    "management": "guided",
    "installMode": "isolated-trial",
    "adapter": "mcp-server",
    "protocol": "mcp",
    "failurePolicy": "discard-process",
    "activation": "restart-plugin"
  },
  "capability": {
    "id": "yi_ji",
    "kind": "tool",
    "invocation": "yi_ji({date: '2030-01-15'})",
    "expected": "📅 2030年1月15日（星期二）\n🧮 干支：庚戌年 · 庚午日\n🌿 五行属金\n✅ 宜：谈判签约、清算对账、断舍离、复盘总结、跨部门沟通、代码评审\n❌ 忌：借贷担保、感情用事、意气用事、拍脑袋定方案、在评审里纠结命名\n⚡ 冲煞：冲鼠（午）\n🧭 幸运方向：东"
  },
  "policy": {
    "sourceExecution": "disabled-until-explicitly-trusted",
    "workspace": "ephemeral",
    "network": "deny-by-default",
    "installScripts": "disabled",
    "currentProfile": "read-only-until-controlled-activation",
    "cleanup": "mandatory"
  },
  "claims": {
    "seamlessInstall": {
      "state": "not-claimed",
      "reason": "only transactional Profile Bundle installation can claim seamless installation"
    },
    "failureIsolation": {
      "state": "candidate",
      "reason": "requires failure injection and discard-process"
    },
    "hotReload": {
      "state": "not-declared",
      "reason": "declared activation is restart-plugin"
    },
    "protocolCompatibility": {
      "state": "candidate",
      "reason": "requires mcp contract checks at the fixed source"
    },
    "registryReadiness": {
      "state": "catalog-only",
      "reason": "this protocol has no current Workshop Registry install authority"
    }
  },
  "blockedReasons": [],
  "steps": [
    {
      "id": "source.immutable",
      "phase": "static",
      "executor": "static",
      "required": true,
      "scope": "source-only",
      "expectedFacts": {
        "sourceImmutable": true
      }
    },
    {
      "id": "manifest.validate",
      "phase": "static",
      "executor": "static",
      "required": true,
      "scope": "source-only",
      "expectedFacts": {
        "manifestValid": true
      }
    },
    {
      "id": "artifact.present",
      "phase": "static",
      "executor": "static",
      "required": true,
      "scope": "source-only",
      "expectedFacts": {
        "artifactPresent": true
      }
    },
    {
      "id": "protocol.contract",
      "phase": "static",
      "executor": "static",
      "required": true,
      "scope": "source-only",
      "expectedFacts": {
        "protocolContractValid": true
      }
    },
    {
      "id": "compatibility.baseline",
      "phase": "static",
      "executor": "static",
      "required": true,
      "scope": "source-only",
      "expectedFacts": {
        "compatibilityPassed": true
      }
    },
    {
      "id": "permissions.review",
      "phase": "static",
      "executor": "static",
      "required": true,
      "scope": "source-only",
      "expectedFacts": {
        "permissionsReviewed": true
      }
    },
    {
      "id": "supply-chain.review",
      "phase": "supply-chain",
      "executor": "static",
      "required": true,
      "scope": "source-only",
      "expectedFacts": {
        "supplyChainPassed": true,
        "installScriptsDisabled": true
      }
    },
    {
      "id": "mcp.server-manifest",
      "phase": "static",
      "executor": "mcp",
      "required": true,
      "scope": "source-only",
      "expectedFacts": {
        "registrySchema": "https://static.modelcontextprotocol.io/schemas/2025-12-11/server.schema.json",
        "serverManifestValid": true
      }
    },
    {
      "id": "mcp.ownership",
      "phase": "supply-chain",
      "executor": "mcp",
      "required": true,
      "scope": "source-only",
      "expectedFacts": {
        "packageOwnershipBound": true
      }
    },
    {
      "id": "sandbox.policy",
      "phase": "sandbox",
      "executor": "mcp",
      "required": true,
      "scope": "ephemeral-workspace",
      "expectedFacts": {
        "workspaceEphemeral": true,
        "networkDeniedByDefault": true,
        "installScriptsDisabled": true,
        "currentProtected": true
      }
    },
    {
      "id": "mcp.process-create",
      "phase": "sandbox",
      "executor": "mcp",
      "required": true,
      "scope": "isolated-process",
      "expectedFacts": {
        "processIsolated": true,
        "currentUntouched": true
      }
    },
    {
      "id": "mcp.discover",
      "phase": "ready",
      "executor": "mcp",
      "required": true,
      "scope": "isolated-process",
      "expectedFacts": {
        "protocolVersion": "2026-07-28",
        "discovered": true,
        "stateless": true
      }
    },
    {
      "id": "mcp.tools-list",
      "phase": "ready",
      "executor": "mcp",
      "required": true,
      "scope": "isolated-process",
      "expectedFacts": {
        "toolsListed": true
      }
    },
    {
      "id": "capability.invoke",
      "phase": "functional",
      "executor": "mcp",
      "required": true,
      "scope": "isolated-process",
      "expectedFacts": {
        "capabilityObserved": true
      }
    },
    {
      "id": "failure.inject-process",
      "phase": "failure",
      "executor": "mcp",
      "required": true,
      "scope": "isolated-process",
      "expectedFacts": {
        "failureInjected": true
      }
    },
    {
      "id": "failure.current-unchanged",
      "phase": "failure",
      "executor": "mcp",
      "required": true,
      "scope": "current-profile-controlled",
      "expectedFacts": {
        "currentUnchanged": true
      }
    },
    {
      "id": "failure.discard-process",
      "phase": "failure",
      "executor": "mcp",
      "required": true,
      "scope": "isolated-process",
      "expectedFacts": {
        "processDiscarded": true
      }
    },
    {
      "id": "lifecycle.restart",
      "phase": "lifecycle",
      "executor": "mcp",
      "required": true,
      "scope": "isolated-process",
      "expectedFacts": {
        "restarted": true,
        "restartScope": "plugin",
        "capabilityObserved": true
      }
    },
    {
      "id": "remove.apply",
      "phase": "remove",
      "executor": "mcp",
      "required": true,
      "scope": "isolated-process",
      "expectedFacts": {
        "removePassed": true,
        "processRemoved": true
      }
    }
  ],
  "evidenceKey": "sha256:1c07818895db7cbec6c444de2c1a76ff0ac5d9153501bbb4abde5c7d33f984f2"
}
