{
  "schema": "omdsh-workshop-harness-plan/v1",
  "engineVersion": "1.1.0",
  "id": "code-talent-scout@0.1.0-rc.2:0.1.0-rc.6:skill",
  "projectId": "code-talent-scout",
  "releaseId": "code-talent-scout@0.1.0-rc.2",
  "source": {
    "repository": "https://github.com/omdsh-dev/toybox",
    "ref": "86e98729b92db0b9fe901c39e32bca74cf8c0f54",
    "path": "/plugins/code-talent-scout/.dsh-plugin"
  },
  "updateFrom": null,
  "baseline": {
    "package": "@deepseek-ai/dsh",
    "version": "0.1.0-rc.6",
    "integrity": "sha512-brpZfED7ieRa2PQ5tUxMhHrM1pb2CmKFVM/f6yMULBDMicahk+Z2OsHgTwTDnoiZm23Ftu9rQz0NN4pflaoJcg=="
  },
  "profileBase": null,
  "loaderAdapter": null,
  "classification": {
    "management": "guided",
    "installMode": "guided",
    "adapter": "skill",
    "protocol": "skill",
    "failurePolicy": "manual",
    "activation": "immediate"
  },
  "capability": null,
  "policy": {
    "sourceExecution": "disabled-until-explicitly-trusted",
    "workspace": "ephemeral",
    "network": "deny-by-default",
    "installScripts": "disabled",
    "currentProfile": "read-only-until-controlled-activation",
    "cleanup": "mandatory"
  },
  "claims": {
    "seamlessInstall": {
      "state": "not-claimed",
      "reason": "only transactional Profile Bundle installation can claim seamless installation"
    },
    "failureIsolation": {
      "state": "not-claimed",
      "reason": "guided installation has manual failure handling"
    },
    "hotReload": {
      "state": "not-declared",
      "reason": "declared activation is immediate"
    },
    "protocolCompatibility": {
      "state": "candidate",
      "reason": "requires skill contract checks at the fixed source"
    },
    "registryReadiness": {
      "state": "catalog-only",
      "reason": "this protocol has no current Workshop Registry install authority"
    }
  },
  "blockedReasons": [],
  "steps": [
    {
      "id": "source.immutable",
      "phase": "static",
      "executor": "static",
      "required": true,
      "scope": "source-only",
      "expectedFacts": {
        "sourceImmutable": true
      }
    },
    {
      "id": "manifest.validate",
      "phase": "static",
      "executor": "static",
      "required": true,
      "scope": "source-only",
      "expectedFacts": {
        "manifestValid": true
      }
    },
    {
      "id": "artifact.present",
      "phase": "static",
      "executor": "static",
      "required": true,
      "scope": "source-only",
      "expectedFacts": {
        "artifactPresent": true
      }
    },
    {
      "id": "protocol.contract",
      "phase": "static",
      "executor": "skill",
      "required": true,
      "scope": "source-only",
      "expectedFacts": {
        "protocolContractValid": true
      }
    },
    {
      "id": "compatibility.baseline",
      "phase": "static",
      "executor": "static",
      "required": true,
      "scope": "source-only",
      "expectedFacts": {
        "compatibilityPassed": true
      }
    },
    {
      "id": "permissions.review",
      "phase": "static",
      "executor": "static",
      "required": true,
      "scope": "source-only",
      "expectedFacts": {
        "permissionsReviewed": true
      }
    },
    {
      "id": "supply-chain.review",
      "phase": "supply-chain",
      "executor": "static",
      "required": true,
      "scope": "source-only",
      "expectedFacts": {
        "supplyChainPassed": true,
        "installScriptsDisabled": true
      }
    },
    {
      "id": "skill.frontmatter",
      "phase": "static",
      "executor": "skill",
      "required": true,
      "scope": "source-only",
      "expectedFacts": {
        "frontmatterValid": true
      }
    },
    {
      "id": "skill.references",
      "phase": "static",
      "executor": "skill",
      "required": true,
      "scope": "source-only",
      "expectedFacts": {
        "referencesResolved": true,
        "pathsContained": true
      }
    },
    {
      "id": "skill.commands-review",
      "phase": "supply-chain",
      "executor": "skill",
      "required": true,
      "scope": "source-only",
      "expectedFacts": {
        "executableIntentReviewed": true
      }
    }
  ],
  "evidenceKey": "sha256:4a43b07ffabebc078bc750ebbd167e18e1501f3028a84157f60c61cb064a6e0c"
}
