{
  "schema": "omdsh-workshop-harness-plan/v1",
  "engineVersion": "1.1.0",
  "id": "dsh-notifier@0.4.0:0.1.0-rc.6:harness-cordis",
  "projectId": "dsh-notifier",
  "releaseId": "dsh-notifier@0.4.0",
  "source": {
    "repository": "https://github.com/THEWOLFWALKER/dsh-notifier",
    "ref": "f7ce623205930f511abd944ffdd66cfc413af7d6",
    "path": null
  },
  "updateFrom": null,
  "baseline": {
    "package": "@deepseek-ai/dsh",
    "version": "0.1.0-rc.6",
    "integrity": "sha512-brpZfED7ieRa2PQ5tUxMhHrM1pb2CmKFVM/f6yMULBDMicahk+Z2OsHgTwTDnoiZm23Ftu9rQz0NN4pflaoJcg=="
  },
  "profileBase": null,
  "loaderAdapter": null,
  "classification": {
    "management": "guided",
    "installMode": "guided",
    "adapter": "third-party",
    "protocol": "harness-cordis",
    "failurePolicy": "manual",
    "activation": "immediate"
  },
  "capability": {
    "id": "notify",
    "kind": "tool",
    "invocation": "invoke the model-facing notify tool with a message and an optional target channel through the DSH ToolRuntime",
    "expected": "the message is delivered to the configured channel (e.g. Telegram) and a structured result is returned; an unreachable or unconfigured channel returns a structured skipped/failed result without blocking the turn"
  },
  "policy": {
    "sourceExecution": "disabled-until-explicitly-trusted",
    "workspace": "ephemeral",
    "network": "deny-by-default",
    "installScripts": "disabled",
    "currentProfile": "read-only-until-controlled-activation",
    "cleanup": "mandatory"
  },
  "claims": {
    "seamlessInstall": {
      "state": "not-claimed",
      "reason": "only transactional Profile Bundle installation can claim seamless installation"
    },
    "failureIsolation": {
      "state": "not-claimed",
      "reason": "guided installation has manual failure handling"
    },
    "hotReload": {
      "state": "not-declared",
      "reason": "declared activation is immediate"
    },
    "protocolCompatibility": {
      "state": "candidate",
      "reason": "requires harness-cordis contract checks at the fixed source"
    },
    "registryReadiness": {
      "state": "catalog-only",
      "reason": "this protocol has no current Workshop Registry install authority"
    }
  },
  "blockedReasons": [],
  "steps": [
    {
      "id": "source.immutable",
      "phase": "static",
      "executor": "static",
      "required": true,
      "scope": "source-only",
      "expectedFacts": {
        "sourceImmutable": true
      }
    },
    {
      "id": "manifest.validate",
      "phase": "static",
      "executor": "static",
      "required": true,
      "scope": "source-only",
      "expectedFacts": {
        "manifestValid": true
      }
    },
    {
      "id": "artifact.present",
      "phase": "static",
      "executor": "static",
      "required": true,
      "scope": "source-only",
      "expectedFacts": {
        "artifactPresent": true
      }
    },
    {
      "id": "protocol.contract",
      "phase": "static",
      "executor": "static",
      "required": true,
      "scope": "source-only",
      "expectedFacts": {
        "protocolContractValid": true
      }
    },
    {
      "id": "compatibility.baseline",
      "phase": "static",
      "executor": "static",
      "required": true,
      "scope": "source-only",
      "expectedFacts": {
        "compatibilityPassed": true
      }
    },
    {
      "id": "permissions.review",
      "phase": "static",
      "executor": "static",
      "required": true,
      "scope": "source-only",
      "expectedFacts": {
        "permissionsReviewed": true
      }
    },
    {
      "id": "supply-chain.review",
      "phase": "supply-chain",
      "executor": "static",
      "required": true,
      "scope": "source-only",
      "expectedFacts": {
        "supplyChainPassed": true,
        "installScriptsDisabled": true
      }
    },
    {
      "id": "cordis.service-contract",
      "phase": "static",
      "executor": "cordis",
      "required": true,
      "scope": "source-only",
      "expectedFacts": {
        "serviceContractValid": true
      }
    },
    {
      "id": "sandbox.policy",
      "phase": "sandbox",
      "executor": "cordis",
      "required": true,
      "scope": "ephemeral-workspace",
      "expectedFacts": {
        "workspaceEphemeral": true,
        "networkDeniedByDefault": true,
        "installScriptsDisabled": true,
        "currentProtected": true
      }
    },
    {
      "id": "cordis.process-create",
      "phase": "sandbox",
      "executor": "cordis",
      "required": true,
      "scope": "isolated-process",
      "expectedFacts": {
        "processIsolated": true,
        "currentUntouched": true
      }
    },
    {
      "id": "cordis.init",
      "phase": "ready",
      "executor": "cordis",
      "required": true,
      "scope": "isolated-process",
      "expectedFacts": {
        "initialized": true,
        "ready": true
      }
    },
    {
      "id": "capability.invoke",
      "phase": "functional",
      "executor": "cordis",
      "required": true,
      "scope": "isolated-process",
      "expectedFacts": {
        "capabilityObserved": true
      }
    },
    {
      "id": "failure.inject-process",
      "phase": "failure",
      "executor": "cordis",
      "required": true,
      "scope": "isolated-process",
      "expectedFacts": {
        "failureInjected": true
      }
    },
    {
      "id": "failure.current-unchanged",
      "phase": "failure",
      "executor": "cordis",
      "required": true,
      "scope": "current-profile-controlled",
      "expectedFacts": {
        "currentUnchanged": true
      }
    },
    {
      "id": "failure.discard-process",
      "phase": "failure",
      "executor": "cordis",
      "required": true,
      "scope": "isolated-process",
      "expectedFacts": {
        "processDiscarded": true
      }
    },
    {
      "id": "cordis.dispose",
      "phase": "remove",
      "executor": "cordis",
      "required": true,
      "scope": "isolated-process",
      "expectedFacts": {
        "disposed": true,
        "processRemoved": true
      }
    }
  ],
  "evidenceKey": "sha256:b3664365322be2b8e4a49a5b408813d854e53e9f66deabd47ff49a8ba74ead77"
}
